{"result_id":"tst:wf-result:referencecity-s010","request_id":"tst:wf-request:referencecity-s010","accepted":false,"state_changed":false,"previous_state":"effective","current_state":"effective","previous_version":"2","current_version":"2","error_code":"TST-WF-006","semantic_code":"VERSION_CONFLICT","audit_event":"verify","idempotent_replay":false,"processed_at":"2030-03-10T01:00:01Z","schema_version":"0.5"}